{
  "id": "science_koutecky_levich",
  "title": "倒数旋转速率与电流分离",
  "domain": "general",
  "type": "demo",
  "license": "MIT",
  "scope": "Original analytic teaching record. Source references support the declared method/derivation only, never this invented parameter set or measurements.",
  "data_status": "synthetic_demo",
  "not_experimental_data": true,
  "source_files": [
    "data.csv",
    "model.json"
  ],
  "test_conditions": "No acquired cell or material. Independently declared analytic parameters, assumptions and units in scientific_basis.",
  "variables_and_units": {
    "1": [
      "Inverse square-root speed (s$^{1/2}$)",
      "Inverse current density (m$^2$ A$^{-1}$)"
    ]
  },
  "creator": "VoltPeer",
  "generator_version": "1.0.0",
  "reproduce": "python render_existing.py --output result-01",
  "scientific_basis": {
    "schema_version": 1,
    "model_class": "analytic_model",
    "data_origin": "original_synthetic",
    "relationship": "Series kinetic/transport inverse currents separate the two limiting contributions.",
    "equations": [
      "1/i=1/ik+(1/B)*omega^(-1/2)"
    ],
    "parameters": {
      "ik_A_m2": 30,
      "B_A_s05_m2": 8
    },
    "assumptions": [
      "Independently declared parameters; no experimental or material fit.",
      "Steady one-direction RDE model; no multi-path interpretation."
    ],
    "limitations": [
      "Steady one-direction RDE model; no multi-path interpretation.",
      "A numerical/model QA pass does not validate author data or a physical mechanism."
    ],
    "constraints": [
      "Finite numerical values and explicit physical units.",
      "Continuous plotted curves are solid without markers; data axes retain four borders.",
      "All plotted responses are nonnegative."
    ],
    "references": [
      {
        "title": "Pine Research: Levich Study (RDE)",
        "doi": "",
        "url": "https://pineresearch.com/support-article/levich-study-rde/",
        "figure_panel": "Levich equation with 0.620 coefficient and Koutecky-Levich inverse-current form",
        "supports": "Series kinetic/transport inverse currents separate the two limiting contributions.",
        "checked_at": "2026-10-03",
        "scope": "Method/equation/caveat reference only. Original analytic teaching inputs; no copied paper points, pixels or experimental inference."
      }
    ],
    "validation": {
      "finite": true,
      "nonnegative": true,
      "unit_interval": false
    },
    "validation_scope": "Source method/principle and explicitly derived restricted teaching specialization checked; equation, units and numerical constraints only. No copied paper measurements, material parameters, experimental fit or mechanism certification."
  },
  "review": {
    "science": "Equation/units/numerical constraints and source scope checked. No author-data validation.",
    "display": "Actual solid/unmarked curve artists, four-frame spines, legend/title and text bounds checked."
  },
  "actual_artist_checks": [
    {
      "panel_index": 0,
      "spines": {
        "left": true,
        "right": true,
        "top": true,
        "bottom": true
      },
      "continuous_curves": [
        {
          "label": "Kinetic plus diffusion",
          "linestyle": "-",
          "marker": "None",
          "points": 241
        }
      ]
    }
  ],
  "data_frame_checks": [
    {
      "panel_index": 0,
      "spines": {
        "left": true,
        "right": true,
        "top": true,
        "bottom": true
      },
      "continuous_curves": [
        {
          "label": "Kinetic plus diffusion",
          "linestyle": "-",
          "marker": "None",
          "points": 241
        }
      ]
    }
  ],
  "continuous_curve_style_checks": [
    {
      "panel_index": 0,
      "label": "Kinetic plus diffusion",
      "points": 241,
      "line_style": "-",
      "marker": "None",
      "colour": "#287d8e"
    }
  ],
  "curve_style_check": "Actual Line2D artists: all continuous curves solid and unmarked.",
  "data_frame_check": "Actual data axes: all four spines visible."
}
