{
  "id": "science_chemical_expansion",
  "title": "锂占位与化学膨胀",
  "domain": "general",
  "type": "demo",
  "license": "MIT",
  "scope": "Original analytic teaching record. Source references support the declared method/derivation only, never this invented parameter set or measurements.",
  "data_status": "synthetic_demo",
  "not_experimental_data": true,
  "source_files": [
    "data.csv",
    "model.json"
  ],
  "test_conditions": "No acquired cell or material. Independently declared analytic parameters, assumptions and units in scientific_basis.",
  "variables_and_units": {
    "1": [
      "Occupied-site fraction",
      "Free linear strain (%)"
    ]
  },
  "creator": "VoltPeer",
  "generator_version": "1.0.0",
  "reproduce": "python render_existing.py --output result-01",
  "scientific_basis": {
    "schema_version": 1,
    "model_class": "analytic_model",
    "data_origin": "original_synthetic",
    "relationship": "Declared volumetric expansion gives isotropic linear strain.",
    "equations": [
      "linear_strain=(1+beta*x)^(1/3)-1"
    ],
    "parameters": {
      "beta_volume_fraction": 0.09
    },
    "assumptions": [
      "Independently declared parameters; no experimental or material fit.",
      "Isotropic free expansion only; no stress when unconstrained and uniform."
    ],
    "limitations": [
      "Isotropic free expansion only; no stress when unconstrained and uniform.",
      "A numerical/model QA pass does not validate author data or a physical mechanism."
    ],
    "constraints": [
      "Finite numerical values and explicit physical units.",
      "Continuous plotted curves are solid without markers; data axes retain four borders.",
      "All plotted responses are nonnegative."
    ],
    "references": [
      {
        "title": "COMSOL: Diffusion-Induced Stress in a Lithium-Ion Battery",
        "doi": "",
        "url": "https://doc.comsol.com/6.3/doc/com.comsol.help.models.battery.lib_diffusion_induced_stress/lib_diffusion_induced_stress.html",
        "figure_panel": "Isotropic elastic diffusion stress, strain energy and quasi-static assumption",
        "supports": "Declared volumetric expansion gives isotropic linear strain.",
        "checked_at": "2026-10-03",
        "scope": "Method/equation/caveat reference only. Original analytic teaching inputs; no copied paper points, pixels or experimental inference."
      }
    ],
    "validation": {
      "finite": true,
      "nonnegative": true,
      "unit_interval": false
    },
    "validation_scope": "Source method/principle and explicitly derived restricted teaching specialization checked; equation, units and numerical constraints only. No copied paper measurements, material parameters, experimental fit or mechanism certification."
  },
  "review": {
    "science": "Equation/units/numerical constraints and source scope checked. No author-data validation.",
    "display": "Actual solid/unmarked curve artists, four-frame spines, legend/title and text bounds checked."
  },
  "actual_artist_checks": [
    {
      "panel_index": 0,
      "spines": {
        "left": true,
        "right": true,
        "top": true,
        "bottom": true
      },
      "continuous_curves": [
        {
          "label": "9% full-occupation volume change",
          "linestyle": "-",
          "marker": "None",
          "points": 241
        }
      ]
    }
  ],
  "data_frame_checks": [
    {
      "panel_index": 0,
      "spines": {
        "left": true,
        "right": true,
        "top": true,
        "bottom": true
      },
      "continuous_curves": [
        {
          "label": "9% full-occupation volume change",
          "linestyle": "-",
          "marker": "None",
          "points": 241
        }
      ]
    }
  ],
  "continuous_curve_style_checks": [
    {
      "panel_index": 0,
      "label": "9% full-occupation volume change",
      "points": 241,
      "line_style": "-",
      "marker": "None",
      "colour": "#287d8e"
    }
  ],
  "curve_style_check": "Actual Line2D artists: all continuous curves solid and unmarked.",
  "data_frame_check": "Actual data axes: all four spines visible."
}
