{
  "id": "science_line_shape_tails",
  "title": "谱线尾部与展宽形式",
  "domain": "general",
  "type": "demo",
  "license": "MIT",
  "scope": "Original analytic teaching record. Source references support the declared method/derivation only, never this invented parameter set or measurements.",
  "data_status": "synthetic_demo",
  "not_experimental_data": true,
  "source_files": [
    "data.csv",
    "model.json"
  ],
  "test_conditions": "No acquired cell or material. Independently declared analytic parameters, assumptions and units in scientific_basis.",
  "variables_and_units": {
    "1": [
      "Frequency offset (relative unit)",
      "Probability-density line shape"
    ]
  },
  "creator": "VoltPeer",
  "generator_version": "1.0.0",
  "reproduce": "python render_existing.py --output result-01",
  "scientific_basis": {
    "schema_version": 1,
    "model_class": "analytic_model",
    "data_origin": "original_synthetic",
    "relationship": "Normalized equal-area Gaussian, Lorentzian and Voigt lines have different tails.",
    "equations": [
      "G=exp(-x²/(2sigma²))/(sigma sqrt(2pi)); L=gamma/[pi(x²+gamma²)]; V=G*L"
    ],
    "parameters": {
      "sigma": 1,
      "gamma": 1,
      "coordinate_unit": "relative frequency unit"
    },
    "assumptions": [
      "Independently declared parameters; no experimental or material fit.",
      "Analytic line-shape comparison only; no chemical assignment or fit."
    ],
    "limitations": [
      "Analytic line-shape comparison only; no chemical assignment or fit.",
      "A numerical/model QA pass does not validate author data or a physical mechanism."
    ],
    "constraints": [
      "Finite numerical values and explicit physical units.",
      "Continuous plotted curves are solid without markers; data axes retain four borders.",
      "All plotted responses are nonnegative."
    ],
    "references": [
      {
        "title": "XrayLarch: XANES analysis, linear methods and pre-edge peak fitting",
        "doi": "",
        "url": "https://xraypy.github.io/xraylarch/xafs_xanes.html",
        "figure_panel": "Sections 14.3.1–14.3.2: Gaussian/Lorentzian/Voigt models and normalized convex spectral mixture",
        "supports": "Normalized equal-area Gaussian, Lorentzian and Voigt lines have different tails.",
        "checked_at": "2026-10-03",
        "scope": "Method/equation/caveat reference only. Original analytic teaching inputs; no copied paper points, pixels or experimental inference."
      }
    ],
    "validation": {
      "finite": true,
      "nonnegative": true,
      "unit_interval": false
    },
    "validation_scope": "Source method/principle and explicitly derived restricted teaching specialization checked; equation, units and numerical constraints only. No copied paper measurements, material parameters, experimental fit or mechanism certification."
  },
  "review": {
    "science": "Equation/units/numerical constraints and source scope checked. No author-data validation.",
    "display": "Actual solid/unmarked curve artists, four-frame spines, legend/title and text bounds checked."
  },
  "actual_artist_checks": [
    {
      "panel_index": 0,
      "spines": {
        "left": true,
        "right": true,
        "top": true,
        "bottom": true
      },
      "continuous_curves": [
        {
          "label": "Gaussian",
          "linestyle": "-",
          "marker": "None",
          "points": 241
        },
        {
          "label": "Lorentzian",
          "linestyle": "-",
          "marker": "None",
          "points": 241
        },
        {
          "label": "Voigt convolution",
          "linestyle": "-",
          "marker": "None",
          "points": 241
        }
      ]
    }
  ],
  "data_frame_checks": [
    {
      "panel_index": 0,
      "spines": {
        "left": true,
        "right": true,
        "top": true,
        "bottom": true
      },
      "continuous_curves": [
        {
          "label": "Gaussian",
          "linestyle": "-",
          "marker": "None",
          "points": 241
        },
        {
          "label": "Lorentzian",
          "linestyle": "-",
          "marker": "None",
          "points": 241
        },
        {
          "label": "Voigt convolution",
          "linestyle": "-",
          "marker": "None",
          "points": 241
        }
      ]
    }
  ],
  "continuous_curve_style_checks": [
    {
      "panel_index": 0,
      "label": "Gaussian",
      "points": 241,
      "line_style": "-",
      "marker": "None",
      "colour": "#287d8e"
    },
    {
      "panel_index": 0,
      "label": "Lorentzian",
      "points": 241,
      "line_style": "-",
      "marker": "None",
      "colour": "#ba5574"
    },
    {
      "panel_index": 0,
      "label": "Voigt convolution",
      "points": 241,
      "line_style": "-",
      "marker": "None",
      "colour": "#4868a8"
    }
  ],
  "curve_style_check": "Actual Line2D artists: all continuous curves solid and unmarked.",
  "data_frame_check": "Actual data axes: all four spines visible."
}
