{
  "id": "science_vanthoff_equilibrium",
  "title": "逆温度与平衡常数",
  "domain": "general",
  "type": "demo",
  "license": "MIT",
  "scope": "Original analytic teaching record. Source references support the declared method/derivation only, never this invented parameter set or measurements.",
  "data_status": "synthetic_demo",
  "not_experimental_data": true,
  "source_files": [
    "data.csv",
    "model.json"
  ],
  "test_conditions": "No acquired cell or material. Independently declared analytic parameters, assumptions and units in scientific_basis.",
  "variables_and_units": {
    "1": [
      "Inverse temperature (K$^{-1}$)",
      "Log equilibrium constant"
    ]
  },
  "creator": "VoltPeer",
  "generator_version": "1.0.0",
  "reproduce": "python render_existing.py --output result-01",
  "scientific_basis": {
    "schema_version": 1,
    "model_class": "analytic_model",
    "data_origin": "original_synthetic",
    "relationship": "Assumed constant reaction enthalpy sets an equilibrium-temperature slope.",
    "equations": [
      "ln K=-DeltaH/(RT)+DeltaS/R"
    ],
    "parameters": {
      "DeltaH_J_mol": -12000,
      "DeltaS_J_molK": -35
    },
    "assumptions": [
      "Independently declared parameters; no experimental or material fit.",
      "Fixed standard states, constant enthalpy/entropy; not a fitted association enthalpy."
    ],
    "limitations": [
      "Fixed standard states, constant enthalpy/entropy; not a fitted association enthalpy.",
      "A numerical/model QA pass does not validate author data or a physical mechanism."
    ],
    "constraints": [
      "Finite numerical values and explicit physical units.",
      "Continuous plotted curves are solid without markers; data axes retain four borders."
    ],
    "references": [
      {
        "title": "IUPAC Green Book: Quantities, Units and Symbols in Physical Chemistry, third edition",
        "doi": "",
        "url": "https://iupac.org/wp-content/uploads/2019/05/IUPAC-GB3-2012-2ndPrinting-PDFsearchable.pdf",
        "figure_panel": "Sections 2.9, 2.11, 2.12, 2.15: statistical weights, activity/free energy, equilibrium kinetics and transport quantities",
        "supports": "Assumed constant reaction enthalpy sets an equilibrium-temperature slope.",
        "checked_at": "2026-10-03",
        "scope": "Method/equation/caveat reference only. Original analytic teaching inputs; no copied paper points, pixels or experimental inference."
      }
    ],
    "validation": {
      "finite": true,
      "nonnegative": false,
      "unit_interval": false
    },
    "validation_scope": "Source method/principle and explicitly derived restricted teaching specialization checked; equation, units and numerical constraints only. No copied paper measurements, material parameters, experimental fit or mechanism certification."
  },
  "review": {
    "science": "Equation/units/numerical constraints and source scope checked. No author-data validation.",
    "display": "Actual solid/unmarked curve artists, four-frame spines, legend/title and text bounds checked."
  },
  "actual_artist_checks": [
    {
      "panel_index": 0,
      "spines": {
        "left": true,
        "right": true,
        "top": true,
        "bottom": true
      },
      "continuous_curves": [
        {
          "label": "Declared equilibrium",
          "linestyle": "-",
          "marker": "None",
          "points": 241
        }
      ]
    }
  ],
  "data_frame_checks": [
    {
      "panel_index": 0,
      "spines": {
        "left": true,
        "right": true,
        "top": true,
        "bottom": true
      },
      "continuous_curves": [
        {
          "label": "Declared equilibrium",
          "linestyle": "-",
          "marker": "None",
          "points": 241
        }
      ]
    }
  ],
  "continuous_curve_style_checks": [
    {
      "panel_index": 0,
      "label": "Declared equilibrium",
      "points": 241,
      "line_style": "-",
      "marker": "None",
      "colour": "#287d8e"
    }
  ],
  "curve_style_check": "Actual Line2D artists: all continuous curves solid and unmarked.",
  "data_frame_check": "Actual data axes: all four spines visible."
}
