{
  "id": "science_entropy_soc_heat",
  "title": "荷电状态与可逆热符号",
  "domain": "general",
  "type": "demo",
  "license": "MIT",
  "scope": "Original analytic teaching record. Source references support the declared method/derivation only, never this invented parameter set or measurements.",
  "data_status": "synthetic_demo",
  "not_experimental_data": true,
  "source_files": [
    "data.csv",
    "model.json"
  ],
  "test_conditions": "No acquired cell or material. Independently declared analytic parameters, assumptions and units in scientific_basis.",
  "variables_and_units": {
    "1": [
      "Model state of charge",
      "Reversible heat (W)"
    ]
  },
  "creator": "VoltPeer",
  "generator_version": "1.0.0",
  "reproduce": "python render_existing.py --output result-01",
  "scientific_basis": {
    "schema_version": 1,
    "model_class": "analytic_model",
    "data_origin": "original_synthetic",
    "relationship": "An explicitly assumed entropy coefficient reverses reversible heat sign.",
    "equations": [
      "Prev=-I*T*dUeq/dT; dUeq/dT=A cos(2pi SOC)"
    ],
    "parameters": {
      "I_A": 1,
      "T_K": 298.15,
      "A_V_K": 0.0003,
      "sign": "positive I = discharge"
    },
    "assumptions": [
      "Independently declared parameters; no experimental or material fit.",
      "Synthetic entropy function, no material assignment; charge reverses the heat sign."
    ],
    "limitations": [
      "Synthetic entropy function, no material assignment; charge reverses the heat sign.",
      "A numerical/model QA pass does not validate author data or a physical mechanism."
    ],
    "constraints": [
      "Finite numerical values and explicit physical units.",
      "Continuous plotted curves are solid without markers; data axes retain four borders."
    ],
    "references": [
      {
        "title": "COMSOL: Theory for Electrochemical Heat Sources",
        "doi": "",
        "url": "https://doc.comsol.com/6.3/doc/com.comsol.help.battery/battery_ug_electrochem.07.106.html",
        "figure_panel": "Ohmic, reaction-overpotential and reversible entropy heat",
        "supports": "An explicitly assumed entropy coefficient reverses reversible heat sign.",
        "checked_at": "2026-10-03",
        "scope": "Method/equation/caveat reference only. Original analytic teaching inputs; no copied paper points, pixels or experimental inference."
      }
    ],
    "validation": {
      "finite": true,
      "nonnegative": false,
      "unit_interval": false
    },
    "validation_scope": "Source method/principle and explicitly derived restricted teaching specialization checked; equation, units and numerical constraints only. No copied paper measurements, material parameters, experimental fit or mechanism certification."
  },
  "review": {
    "science": "Equation/units/numerical constraints and source scope checked. No author-data validation.",
    "display": "Actual solid/unmarked curve artists, four-frame spines, legend/title and text bounds checked."
  },
  "actual_artist_checks": [
    {
      "panel_index": 0,
      "spines": {
        "left": true,
        "right": true,
        "top": true,
        "bottom": true
      },
      "continuous_curves": [
        {
          "label": "Discharge 1 A",
          "linestyle": "-",
          "marker": "None",
          "points": 241
        },
        {
          "label": "Charge 1 A",
          "linestyle": "-",
          "marker": "None",
          "points": 241
        }
      ]
    }
  ],
  "data_frame_checks": [
    {
      "panel_index": 0,
      "spines": {
        "left": true,
        "right": true,
        "top": true,
        "bottom": true
      },
      "continuous_curves": [
        {
          "label": "Discharge 1 A",
          "linestyle": "-",
          "marker": "None",
          "points": 241
        },
        {
          "label": "Charge 1 A",
          "linestyle": "-",
          "marker": "None",
          "points": 241
        }
      ]
    }
  ],
  "continuous_curve_style_checks": [
    {
      "panel_index": 0,
      "label": "Discharge 1 A",
      "points": 241,
      "line_style": "-",
      "marker": "None",
      "colour": "#287d8e"
    },
    {
      "panel_index": 0,
      "label": "Charge 1 A",
      "points": 241,
      "line_style": "-",
      "marker": "None",
      "colour": "#ba5574"
    }
  ],
  "curve_style_check": "Actual Line2D artists: all continuous curves solid and unmarked.",
  "data_frame_check": "Actual data axes: all four spines visible."
}
