{
  "id": "science_collector_mass_penalty",
  "title": "集流体厚度与比能",
  "domain": "general",
  "type": "demo",
  "license": "MIT",
  "scope": "Original analytic teaching record. Source references support the declared method/derivation only, never this invented parameter set or measurements.",
  "data_status": "synthetic_demo",
  "not_experimental_data": true,
  "source_files": [
    "data.csv",
    "model.json"
  ],
  "test_conditions": "No acquired cell or material. Independently declared analytic parameters, assumptions and units in scientific_basis.",
  "variables_and_units": {
    "1": [
      "Collector thickness (µm)",
      "Specific energy (Wh kg$^{-1}$)"
    ]
  },
  "creator": "VoltPeer",
  "generator_version": "1.0.0",
  "reproduce": "python render_existing.py --output result-01",
  "scientific_basis": {
    "schema_version": 1,
    "model_class": "analytic_model",
    "data_origin": "original_synthetic",
    "relationship": "Current-collector mass changes cell-normalized specific energy.",
    "equations": [
      "mCC=rho*A*L; Egrav=1000*E/(mfixed+mCC)"
    ],
    "parameters": {
      "rho_g_cm3": 8.96,
      "area_cm2": 100,
      "E_Wh": 3.7,
      "mfixed_g": 15
    },
    "assumptions": [
      "Independently declared parameters; no experimental or material fit.",
      "No resistance/strength optimization; a uniform Cu collector is an assumed bookkeeping component."
    ],
    "limitations": [
      "No resistance/strength optimization; a uniform Cu collector is an assumed bookkeeping component.",
      "A numerical/model QA pass does not validate author data or a physical mechanism."
    ],
    "constraints": [
      "Finite numerical values and explicit physical units.",
      "Continuous plotted curves are solid without markers; data axes retain four borders.",
      "All plotted responses are nonnegative."
    ],
    "references": [
      {
        "title": "COMSOL: Theory for the Lithium-Ion Battery Interface",
        "doi": "",
        "url": "https://doc.comsol.com/6.4/doc/com.comsol.help.battery/battery_ug_electrochem_battery.06.63.html",
        "figure_panel": "Cell capacity, site occupation, Fick transport and elastic particle stress",
        "supports": "Current-collector mass changes cell-normalized specific energy.",
        "checked_at": "2026-10-03",
        "scope": "Method/equation/caveat reference only. Original analytic teaching inputs; no copied paper points, pixels or experimental inference."
      }
    ],
    "validation": {
      "finite": true,
      "nonnegative": true,
      "unit_interval": false
    },
    "validation_scope": "Source method/principle and explicitly derived restricted teaching specialization checked; equation, units and numerical constraints only. No copied paper measurements, material parameters, experimental fit or mechanism certification."
  },
  "review": {
    "science": "Equation/units/numerical constraints and source scope checked. No author-data validation.",
    "display": "Actual solid/unmarked curve artists, four-frame spines, legend/title and text bounds checked."
  },
  "actual_artist_checks": [
    {
      "panel_index": 0,
      "spines": {
        "left": true,
        "right": true,
        "top": true,
        "bottom": true
      },
      "continuous_curves": [
        {
          "label": "Fixed active stack",
          "linestyle": "-",
          "marker": "None",
          "points": 241
        }
      ]
    }
  ],
  "data_frame_checks": [
    {
      "panel_index": 0,
      "spines": {
        "left": true,
        "right": true,
        "top": true,
        "bottom": true
      },
      "continuous_curves": [
        {
          "label": "Fixed active stack",
          "linestyle": "-",
          "marker": "None",
          "points": 241
        }
      ]
    }
  ],
  "continuous_curve_style_checks": [
    {
      "panel_index": 0,
      "label": "Fixed active stack",
      "points": 241,
      "line_style": "-",
      "marker": "None",
      "colour": "#287d8e"
    }
  ],
  "curve_style_check": "Actual Line2D artists: all continuous curves solid and unmarked.",
  "data_frame_check": "Actual data axes: all four spines visible."
}
